{
  "ucp": {
    "version": "2026-01-01",
    "status": "success",
    "capabilities": {
      "dev.ucp.shopping.cart": [
        {
          "version": "2026-01-01"
        }
      ],
      "dev.ucp.shopping.incentives": [
        {
          "version": "2026-01-01",
          "extends": [
            "dev.ucp.shopping.catalog.search",
            "dev.ucp.shopping.catalog.lookup",
            "dev.ucp.shopping.cart",
            "dev.ucp.shopping.checkout"
          ]
        }
      ]
    }
  },
  "id": "cart_scaffold",
  "currency": "USD",
  "line_items": [
    {
      "id": "li_scaffold",
      "item": {
        "id": "item_scaffold",
        "title": "Scaffold Item",
        "price": 1000
      },
      "quantity": 1,
      "totals": [
        {
          "type": "subtotal",
          "amount": 1000
        },
        {
          "type": "total",
          "amount": 1000
        }
      ]
    }
  ],
  "totals": [
    {
      "type": "subtotal",
      "amount": 1000
    },
    {
      "type": "total",
      "amount": 1000
    }
  ]
}
